<?xml version="1.0" encoding="UTF-8"?>

<xs:schema xmlns:xs="http://www.w3.org/2001/XMLSchema" elementFormDefault="qualified">


    <xs:simpleType name="tanevTipus">
        <xs:restriction base="xs:string">
            <xs:pattern value="[0-9]{4}/[0-9]{4}" />
        </xs:restriction>
    </xs:simpleType>

    <xs:simpleType name="egyetemTipus">
        <xs:restriction base="xs:string">
            <xs:enumeration value="Miskolci Egyetem" />
        </xs:restriction>
    </xs:simpleType>

    <xs:simpleType name="idTipus">
        <xs:restriction base="xs:string">
            <xs:pattern value="[A-Z0-9\-]+" />
        </xs:restriction>
    </xs:simpleType>

    <xs:simpleType name="igenNemTipus">
        <xs:restriction base="xs:string">
            <xs:enumeration value="igen" />
            <xs:enumeration value="nem" />
        </xs:restriction>
    </xs:simpleType>


    <xs:element name="FXVAUU_kurzusfelvetel">
        <xs:complexType>
            <xs:sequence>
                <xs:element ref="hallgato" />
                <xs:element ref="kurzusok" />
            </xs:sequence>
            <xs:attribute name="tanÃ©v" type="tanevTipus" use="required" />
            <xs:attribute name="egyetem" type="egyetemTipus" use="required" />
        </xs:complexType>
    </xs:element>


    <xs:element name="hallgato">
        <xs:complexType>
            <xs:sequence>
                <xs:element name="hnev" type="xs:string" />
                <xs:element name="szulev" type="xs:gYear" />
                <xs:element name="szak">
                    <xs:complexType>
                        <xs:simpleContent>
                            <xs:extension base="xs:string">
                                <xs:attribute name="evf" type="xs:integer" use="required" />
                            </xs:extension>
                        </xs:simpleContent>
                    </xs:complexType>
                </xs:element>
            </xs:sequence>
        </xs:complexType>
    </xs:element>


    <xs:element name="kurzusok">
        <xs:complexType>
            <xs:sequence>
                <xs:element name="kurzus" maxOccurs="unbounded">
                    <xs:complexType>
                        <xs:sequence>
                            <xs:element name="kurzusnev" type="xs:string" />
                            <xs:element name="kredit" type="xs:integer" />
                            <xs:element name="hely" type="xs:string" />
                            <xs:element name="idopont" type="xs:string" />
                            <xs:element name="oktato" type="xs:string" />
                            <xs:element name="oraado" type="xs:string" minOccurs="0" />
                        </xs:sequence>
                        <xs:attribute name="id" type="idTipus" use="required" />
                        <xs:attribute name="jovahagyas" type="igenNemTipus" use="optional" />
                        <xs:attribute name="nyelv" type="xs:string" use="optional" />
                    </xs:complexType>
                </xs:element>
            </xs:sequence>
        </xs:complexType>
    </xs:element>

</xs:schema>