<?xml version="1.0" encoding="UTF-8"?>

<FXVAUU_kurzusfelvetel xmlns:xsi="http://www.w3.org/2001/XMLSchema-instance"
    xsi:noNamespaceSchemaLocation="FXVAUU_kurzusfelvetel.xsd" tanév="2025/2026"
    egyetem="Miskolci Egyetem">
    <hallgato>
        <hnev>Zagyva Zsombor Gábor</hnev>
        <szulev>2002</szulev>
        <szak evf="3">Mérnök-informatikus BSc</szak>
    </hallgato>
    <kurzusok>
        <kurzus id="GEVEE050-B2">
            <kurzusnev>Elektrotechnika-elektronika</kurzusnev>
            <kredit>5</kredit>
            <hely>E3</hely>
            <idopont>Hétfő 8-10</idopont>
            <oktato>Szabó Norbert István</oktato>
        </kurzus>

        <kurzus id="GEIAL331-B2" jovahagyas="igen" nyelv="magyar">
            <kurzusnev>Web technológiák 1.</kurzusnev>
            <kredit>5</kredit>
            <hely>E5</hely>
            <idopont>Hétfő 10-12</idopont>
            <oktato>Dr. Agárdi Anita</oktato>
        </kurzus>

        <kurzus id="GEIAK130-B2">
            <kurzusnev>Mesterséges intelligencia alapok</kurzusnev>
            <kredit>5</kredit>
            <hely>E32</hely>
            <idopont>Kedd 10-12</idopont>
            <oktato>Kunné Dr. Tamás Judit,</oktato>
            <oraado>Fazekas Levente Áron</oraado>
        </kurzus>

        <kurzus id="GEIAL30A-B2" jovahagyas="igen" nyelv="magyar">
            <kurzusnev>Windows rendszergazda</kurzusnev>
            <kredit>5</kredit>
            <hely>L103</hely>
            <idopont>Kedd 8-10</idopont>
            <oktato>Dr. Wagner György</oktato>
        </kurzus>

        <kurzus id="GEIAL335-B2">
            <kurzusnev>Mobil programozási alapok</kurzusnev>
            <kredit>5</kredit>
            <hely>L101</hely>
            <idopont>Hétfő 16-18</idopont>
            <oktato>Dr. Agárdi Anita</oktato>
            <oraado>Dr. Agárdi Anita</oraado>
        </kurzus>
    </kurzusok>
</FXVAUU_kurzusfelvetel>